{
  "$schema": "https://json-schema.org/draft/2020-12/schema",
  "$id": "https://prompt-atoms.com/schemas/composition-v1.json",
  "title": "prompt-atoms v1 composition",
  "description": "A prompt composition assembling typed prompt fragments into a complete, deterministic prompt sequence with defined turn structure. Supports both the legacy flat `references` model and the XAIP `turns` sequence model.",
  "type": "object",
  "required": ["schema", "type", "id", "version", "name"],
  "additionalProperties": false,
  "properties": {
    "schema": {
      "type": "string",
      "const": "https://prompt-atoms.com/schemas/composition-v1.json"
    },
    "type": { "type": "string", "const": "prompt" },
    "id": {
      "type": "string",
      "pattern": "^[a-z0-9][a-z0-9-]{1,62}[a-z0-9]$"
    },
    "version": {
      "type": "string",
      "pattern": "^[0-9]+\\.[0-9]+\\.[0-9]+(?:-[A-Za-z0-9.-]+)?$"
    },
    "name": { "type": "string", "minLength": 1, "maxLength": 80 },
    "description": { "type": "string", "maxLength": 500 },
    "tags": {
      "type": "array",
      "items": { "type": "string", "minLength": 1, "maxLength": 40 },
      "uniqueItems": true
    },
    "vendors": {
      "type": "array",
      "items": { "type": "string", "enum": ["claude", "gpt", "llama", "gemini", "mistral", "any"] },
      "uniqueItems": true
    },
    "turns": {
      "description": "XAIP turn sequence. Each entry maps a role to either an atom reference or an inline template. At least one system turn is required. User turns SHOULD follow all system turns. Tool turns MUST reference a tool-use-template atom.",
      "type": "array",
      "minItems": 1,
      "items": { "$ref": "#/$defs/turn" }
    },
    "output_schema_ref": {
      "description": "Reference to an output-schema atom that constrains the final response structure. Recommended for structured output compositions.",
      "$ref": "#/$defs/ref"
    },
    "references": {
      "description": "Legacy flat reference model (pre-XAIP). New compositions SHOULD use `turns` instead.",
      "type": "object",
      "required": ["persona"],
      "additionalProperties": false,
      "properties": {
        "persona":            { "$ref": "#/$defs/ref" },
        "constraints":        { "type": "array", "items": { "$ref": "#/$defs/ref" }, "uniqueItems": true },
        "format_instruction": { "$ref": "#/$defs/ref" },
        "tool_use_template":  { "$ref": "#/$defs/ref" },
        "refusal_patterns":   { "type": "array", "items": { "$ref": "#/$defs/ref" }, "uniqueItems": true },
        "output_schema":      { "$ref": "#/$defs/ref" }
      }
    }
  },
  "$defs": {
    "ref": {
      "type": "object",
      "required": ["ref", "version"],
      "additionalProperties": false,
      "properties": {
        "ref": {
          "type": "string",
          "pattern": "^prompt-atoms://atoms/[a-z-]+/[a-z0-9-]+$"
        },
        "version": {
          "type": "string",
          "pattern": "^[0-9]+\\.[0-9]+\\.[0-9]+(?:-[A-Za-z0-9.-]+)?$"
        }
      }
    },
    "turn": {
      "description": "A single turn in a prompt sequence. Exactly one of `atom_ref` or `template` must be present.",
      "type": "object",
      "required": ["role"],
      "additionalProperties": false,
      "properties": {
        "role": {
          "type": "string",
          "enum": ["system", "user", "tool", "assistant-seed"],
          "description": "Turn type: system (initial instructions), user (task/instruction), tool (tool definitions), assistant-seed (few-shot response prefix)."
        },
        "atom_ref": {
          "description": "Reference to a prompt-atoms atom that supplies this turn's content.",
          "$ref": "#/$defs/ref"
        },
        "template": {
          "description": "Inline template string. Use {variable_name} placeholders for runtime substitution.",
          "type": "string",
          "minLength": 1
        }
      },
      "oneOf": [
        { "required": ["atom_ref"], "not": { "required": ["template"] } },
        { "required": ["template"], "not": { "required": ["atom_ref"] } }
      ]
    }
  }
}
